id,created,createdBy,updated,updatedBy,questionText,questionType,categoryId,answersCount,responseType,isRequired,subCategoryId,categoryName,subCategoryName
295,"2024-08-14T09:37:52.000Z",3931,"2024-08-14T10:20:36.000Z",3931,"How sophisticated and effective is your organization's data architecture in supporting business objectives and data-driven decision making?","Single Choice",6,6,"",1,3,"Data Architecture","Data Architecture"
296,"2024-08-14T09:38:10.000Z",3931,"2024-08-14T10:22:12.000Z",3931,"In your organization, do specific data domains (e.g., customers, providers, and products) have their own system of record (i.e., a single system for backing up and retrieving information to ensure data integrity and traceability of changes)?","Single Choice",6,6,"",1,3,"Data Architecture","Data Architecture"
297,"2024-08-14T09:38:26.000Z",3931,"2024-08-14T10:23:37.000Z",3931,"How confident are you that your answers for this section are correct and offer a fair and balanced view?","Single Choice",6,6,"",1,3,"Data Architecture","Data Architecture"
298,"2024-08-14T10:24:21.000Z",3931,"2024-08-14T10:29:11.000Z",3931,"Do you have documentation and/or an enterprise model of your data, showing how it interacts with different systems?","Single Choice",8,6,"",1,7,"Data Modeling and Design","Data Modeling and Design"
299,"2024-08-14T10:24:48.000Z",3931,"2024-08-14T11:43:57.000Z",3931,"Do you have defined and documented data flow diagrams detailing how data flows through your organisation and who uses it?","Single Choice",8,6,"",1,7,"Data Modeling and Design","Data Modeling and Design"
300,"2024-08-14T10:25:04.000Z",3931,"2024-08-14T11:47:43.000Z",3931,"In your organization, is there a strategy to reduce the number of non-regulatory changes made to databases?","Single Choice",8,6,"",1,7,"Data Modeling and Design","Data Modeling and Design"
301,"2024-08-14T10:25:21.000Z",3931,"2024-08-14T11:50:16.000Z",3931,"Do you validate your data models against industry standards or best practice?","Single Choice",8,6,"",1,7,"Data Modeling and Design","Data Modeling and Design"
302,"2024-08-14T10:25:37.000Z",3931,"2024-08-14T11:52:47.000Z",3931,"In your organization, do you use internal controls that certify reports for financial and compliance purposes?","Single Choice",8,6,"",1,7,"Data Modeling and Design","Data Modeling and Design"
303,"2024-08-14T10:25:58.000Z",3931,"2024-08-14T12:04:40.000Z",3931,"In your organization, how do you rate the quality of the internal controls that certify reports for financial and compliance purposes?","Single Choice",8,6,"",1,7,"Data Modeling and Design","Data Modeling and Design"
304,"2024-08-14T10:26:15.000Z",3931,"2024-08-14T12:07:12.000Z",3931,"In your organization, do you use systems for monitoring database changes made by users?","Single Choice",8,6,"",1,7,"Data Modeling and Design","Data Modeling and Design"
305,"2024-08-14T10:26:31.000Z",3931,"2024-08-14T12:08:55.000Z",3931,"In your organization, do you audit changes made to critical data?","Single Choice",8,6,"",1,7,"Data Modeling and Design","Data Modeling and Design"
306,"2024-08-14T10:26:52.000Z",3931,"2024-08-14T12:19:48.000Z",3931,"In your organization, how do you rate the quality of the critical data changes audit checks?","Single Choice",8,6,"",1,7,"Data Modeling and Design","Data Modeling and Design"
307,"2024-08-14T10:27:08.000Z",3931,"2024-08-14T12:31:44.000Z",3931,"How confident are you that your answers for this section are correct and offer a fair and balanced view?","Single Choice",8,6,"",1,7,"Data Modeling and Design","Data Modeling and Design"
308,"2024-08-14T12:40:38.000Z",3931,"2024-08-14T12:49:31.000Z",3931,"Is senior management fully committed to data and its importance?","Single Choice",9,6,"",1,11,"Data Storage and Operations","Data Storage and Operations"
309,"2024-08-14T12:43:05.000Z",3931,"2024-08-14T12:51:56.000Z",3931,"Are funding and budgeting sufficient to address storage now and in the future?","Single Choice",9,6,"",1,11,"Data Storage and Operations","Data Storage and Operations"
310,"2024-08-14T12:43:31.000Z",3931,"2024-08-14T12:53:45.000Z",3931,"Is the data storage infrastructure current, and does it address longer-term requirements?","Single Choice",9,6,"",1,11,"Data Storage and Operations","Data Storage and Operations"
311,"2024-08-14T12:43:48.000Z",3931,"2024-08-14T12:56:07.000Z",3931,"Is data stored in secure locations and protected from cyber-threats?","Single Choice",9,6,"",1,11,"Data Storage and Operations","Data Storage and Operations"
312,"2024-08-14T12:44:08.000Z",3931,"2024-08-14T12:58:19.000Z",3931,"Is the data storage program compliant with storage and management standards and regulations?","Single Choice",9,6,"",1,11,"Data Storage and Operations","Data Storage and Operations"
313,"2024-08-14T12:44:28.000Z",3931,"2024-08-14T13:00:06.000Z",3931,"Can the organization quickly increase storage capacity?","Single Choice",9,6,"",1,11,"Data Storage and Operations","Data Storage and Operations"
314,"2024-08-14T12:44:57.000Z",3931,"2024-08-14T13:03:28.000Z",3931,"Are existing cloud storage services sufficient, and do they provide value for money?","Single Choice",9,6,"",1,11,"Data Storage and Operations","Data Storage and Operations"
315,"2024-08-14T12:45:20.000Z",3931,"2024-08-14T13:05:31.000Z",3931,"Has the organization made environmental considerations for data storage?","Single Choice",9,6,"",1,11,"Data Storage and Operations","Data Storage and Operations"
316,"2024-08-14T12:45:34.000Z",3931,"2024-08-14T13:14:00.000Z",3931,"Is the data storage sufficient for a disaster recovery situation?","Single Choice",9,6,"",1,11,"Data Storage and Operations","Data Storage and Operations"
317,"2024-08-14T12:46:35.000Z",3931,"2024-08-14T13:22:28.000Z",3931,"Do you use AI as part of your data operations management?","Single Choice",9,6,"",1,11,"Data Storage and Operations","Data Storage and Operations"
318,"2024-08-14T12:46:53.000Z",3931,"2024-08-14T13:24:25.000Z",3931,"How confident are you that your answers for this section are correct and offer a fair and balanced view?","Single Choice",9,6,"",1,11,"Data Storage and Operations","Data Storage and Operations"
319,"2024-08-16T11:04:58.000Z",3888,"2024-08-16T11:04:58.000Z",3888,"Test Question 1","Single Choice",49,3,"",1,72,"test level","test level 2"
320,"2024-08-19T05:57:20.000Z",3931,"2024-08-19T05:57:20.000Z",3931,"We have a well define Vision and Strategy on how to adopt and manage AI Going forwards.","Single Choice",50,5,"",1,73,"Strategy & Leadership","Vision & Strategy"
321,"2024-08-19T05:57:21.000Z",3931,"2024-08-19T05:57:21.000Z",3931,"Our senior leadership team are actively promoting the use of AI in the buiness.","Single Choice",50,5,"",1,74,"Strategy & Leadership","Executive Sponsorship"
322,"2024-08-19T05:57:21.000Z",3931,"2024-08-19T05:57:21.000Z",3931,"We have a budget set aside to consume AI.","Single Choice",50,5,"",1,75,"Strategy & Leadership","Investment"
323,"2024-08-19T05:57:22.000Z",3931,"2024-08-19T05:57:22.000Z",3931,"We understand our data structures and data is readily available for AI to read and interpret it.","Single Choice",53,5,"",1,76,"Data Management & Infrastructure","Data Availability"
324,"2024-08-19T05:57:22.000Z",3931,"2024-08-19T05:57:22.000Z",3931,"Our data is clean, accurate and relevent.","Single Choice",53,5,"",1,77,"Data Management & Infrastructure","Data Quality"
325,"2024-08-19T05:57:22.000Z",3931,"2024-08-27T02:38:54.000Z",3931,"Our IT Infrastructure is fit for purpose and ready to integrate with AI.","Single Choice",53,5,"",1,79,"Data Management & Infrastructure","Infrastructure"
326,"2024-08-19T05:57:22.000Z",3931,"2024-08-19T05:57:22.000Z",3931,"Our company has invested in people with AI skills and we are ready to do some cool stuff.","Single Choice",54,5,"",1,85,"Talent & Skills","AI Expertise"
327,"2024-08-19T05:57:22.000Z",3931,"2024-08-19T05:57:22.000Z",3931,"We have training programs in place to inform our users on how to utilise AI in an ethical and secure manner.","Single Choice",54,5,"",1,86,"Talent & Skills","Training Programs"
328,"2024-08-19T05:57:22.000Z",3931,"2024-08-19T05:57:22.000Z",3931,"We have a strategy to attract and retain AI talent","Single Choice",54,5,"",1,87,"Talent & Skills","Hiring Strategy"
329,"2024-08-19T05:57:22.000Z",3931,"2024-08-19T05:57:22.000Z",3931,"Are there appropriate tools and platforms for AI development and deployment.","Single Choice",55,5,"",1,88,"Technology & Tools","AI Tools & Platforms"
330,"2024-08-19T05:57:22.000Z",3931,"2024-08-27T02:40:25.000Z",3931,"How well are AI tools integrated with existing systems.","Single Choice",55,5,"",1,89,"Technology & Tools","Integration"
331,"2024-08-19T05:57:23.000Z",3931,"2024-08-19T05:57:23.000Z",3931,"The business is leveraging the latest AI technologies and methodologies.","Single Choice",55,5,"",1,90,"Technology & Tools","Innovation"
332,"2024-08-19T05:57:23.000Z",3931,"2024-08-19T05:57:23.000Z",3931,"We have clear guidelines on the ethical use of AI.","Single Choice",51,5,"",1,78,"Governance & Ethics","Ethical Standards"
333,"2024-08-19T05:57:23.000Z",3931,"2024-08-19T05:57:23.000Z",3931,"The company is compliant with relevant regulations and standards.","Single Choice",51,5,"",1,80,"Governance & Ethics","Compliance"
334,"2024-08-19T05:57:23.000Z",3931,"2024-08-27T02:42:32.000Z",3931,"We have robust processes to manage risks associated with AI?","Single Choice",51,5,"",1,81,"Governance & Ethics","Risk Management"
335,"2024-08-19T05:57:23.000Z",3931,"2024-08-27T02:43:20.000Z",3931,"We have a culture that supports AI adoption and innovation.","Single Choice",52,5,"",1,82,"Culture & Change Management","AI Adoption"
336,"2024-08-19T05:57:23.000Z",3931,"2024-08-27T02:43:32.000Z",3931,"We have effective change management processes in place that cater for AI.","Single Choice",52,5,"",1,83,"Culture & Change Management","Change Management"
337,"2024-08-19T05:57:23.000Z",3931,"2024-08-19T05:57:23.000Z",3931,"Our employees are engaged and supportive of AI initiatives?","Single Choice",52,5,"",1,84,"Culture & Change Management","Employee Buy-In"
338,"2024-08-19T06:58:04.000Z",3931,"2024-08-19T07:00:01.000Z",3931,"In your organization, is there a data governance security and privacy policy for the data in structured and semi-structured formats?","Single Choice",12,6,"",1,17,"Data Security","Data Security"
339,"2024-08-19T07:00:30.000Z",3931,"2024-08-19T07:02:02.000Z",3931,"In your organization, is there any governance, security and privacy policy for  unstructured data (e.g. not in a relational database)?","Single Choice",12,6,"",1,17,"Data Security","Data Security"
340,"2024-08-19T07:02:30.000Z",3931,"2024-08-19T07:05:07.000Z",3931,"In your organization, is there an IT Security Director/Specialist and are they involved in a Data Governance Board?","Single Choice",12,6,"",1,17,"Data Security","Data Security"
341,"2024-08-19T07:06:29.000Z",3931,"2024-08-19T07:08:21.000Z",3931,"Is your organization subject to confidentiality regulations?","Single Choice",12,6,"",1,17,"Data Security","Data Security"
342,"2024-08-19T07:08:51.000Z",3931,"2024-08-19T07:13:33.000Z",3931,"Does your organization fail confidentiality audits?","Single Choice",12,6,"",1,17,"Data Security","Data Security"
343,"2024-08-19T07:18:28.000Z",3931,"2024-08-19T07:20:14.000Z",3931,"In your organization, is sensitive data encrypted?","Single Choice",12,6,"",1,17,"Data Security","Data Security"
344,"2024-08-19T07:27:21.000Z",3931,"2024-08-19T07:32:36.000Z",0,"In your organization, is unencrypted sensitive data used to develop or test systems?","Single Choice",12,-1,"",1,17,"Data Security","Data Security"
345,"2024-08-19T08:39:17.000Z",3931,"2024-08-19T08:40:41.000Z",3931,"In your organization, do administrators, subcontractors or third parties have access to unencrypted sensitive data?","Single Choice",12,6,"",1,17,"Data Security","Data Security"
346,"2024-08-19T08:41:17.000Z",3931,"2024-08-19T08:43:29.000Z",3931,"In your organization, are systems used to monitor access to sensitive data by users with privileges (such as database administrators)?","Single Choice",12,6,"",1,17,"Data Security","Data Security"
347,"2024-08-19T08:43:59.000Z",3931,"2024-08-19T08:45:25.000Z",3931,"How confident are you that your answers for this section are correct and offer a fair and balanced view?","Single Choice",12,6,"",1,17,"Data Security","Data Security"
348,"2024-08-19T08:47:46.000Z",3931,"2024-08-21T05:07:39.000Z",0,"How effectively does your organization integrate and manage data across disparate systems to ensure interoperability and real-time data availability?","Single Choice",14,6,"",1,0,"Data Integration and Interoperability",""
349,"2024-08-19T08:50:29.000Z",3931,"2024-08-21T05:07:39.000Z",0,"How effectively does your organization manage its documents and content across various platforms and systems to ensure accessibility, security, and compliance?","Single Choice",14,6,"",1,0,"Data Integration and Interoperability",""
350,"2024-08-19T08:57:30.000Z",3931,"2024-08-21T05:07:39.000Z",0,"How does your organization manage and utilize reference and master data to ensure consistency and accuracy across business operations?","Single Choice",14,6,"",1,0,"Data Integration and Interoperability",""
351,"2024-08-19T08:59:45.000Z",3931,"2024-08-21T05:07:39.000Z",0,"How confident are you that your answers for this section are correct and offer a fair and balanced view?","Single Choice",14,6,"",1,0,"Data Integration and Interoperability",""
352,"2024-08-19T09:10:53.000Z",3931,"2024-08-19T09:12:50.000Z",3931,"Does your company use a document and content managed system such as SharePoint or Livelink?","Single Choice",16,6,"",1,25,"Document & Content Management","Document & Content Management"
353,"2024-08-19T09:13:18.000Z",3931,"2024-08-19T09:14:50.000Z",3931,"In your organization, is there a policy on archiving electronic information from all data sources?","Single Choice",16,6,"",1,25,"Document & Content Management","Document & Content Management"
354,"2024-08-19T09:15:35.000Z",3931,"2024-08-19T09:17:02.000Z",3931,"In your organization, is there a policy on the types of documents that can be scanned?","Single Choice",16,6,"",1,25,"Document & Content Management","Document & Content Management"
355,"2024-08-19T09:22:36.000Z",3931,"2024-08-19T09:24:04.000Z",3931,"In your organization, to what extent are the content management systems automated? (e.g. versioning, archiving, removal of documents)","Single Choice",16,6,"",1,25,"Document & Content Management","Document & Content Management"
356,"2024-08-19T09:24:34.000Z",3931,"2024-08-19T09:27:12.000Z",3931,"How confident are you that your answers for this section are correct and offer a fair and balanced view?","Single Choice",16,6,"",1,25,"Document & Content Management","Document & Content Management"
357,"2024-08-19T09:56:51.000Z",3931,"2024-08-19T09:56:51.000Z",3931,"Our organization has a clear strategy for adopting no/low code platforms.","Single Choice",56,5,"",1,91,"Strategy and Vision","Strategy and Vision"
358,"2024-08-19T09:56:52.000Z",3931,"2024-08-19T09:56:52.000Z",3931,"The leadership team supports the adoption of no/low code technologies.","Single Choice",56,5,"",1,91,"Strategy and Vision","Strategy and Vision"
359,"2024-08-19T09:56:52.000Z",3931,"2024-08-19T09:56:52.000Z",3931,"We have set specific goals and KPIs for measuring the success of no/low code platform adoption.","Single Choice",56,5,"",1,91,"Strategy and Vision","Strategy and Vision"
360,"2024-08-19T09:56:53.000Z",3931,"2024-08-19T09:56:53.000Z",3931,"We have established governance policies for the use of no/low code platforms.","Single Choice",57,5,"",1,92,"Governance and Compliance","Governance and Compliance"
361,"2024-08-19T09:56:53.000Z",3931,"2024-08-19T09:56:53.000Z",3931,"Our organization ensures compliance with industry standards and regulations when using no/low code solutions.","Single Choice",57,5,"",1,92,"Governance and Compliance","Governance and Compliance"
362,"2024-08-19T09:56:53.000Z",3931,"2024-08-19T09:56:53.000Z",3931,"There is a dedicated team responsible for overseeing no/low code platform governance.","Single Choice",57,5,"",1,92,"Governance and Compliance","Governance and Compliance"
363,"2024-08-19T09:56:53.000Z",3931,"2024-08-19T09:56:53.000Z",3931,"Employees have received adequate training on using no/low code platforms.","Single Choice",58,5,"",1,93,"Skills and Training","Skills and Training"
364,"2024-08-19T09:56:53.000Z",3931,"2024-08-19T09:56:53.000Z",3931,"We have access to resources and support for troubleshooting and developing on no/low code platforms.","Single Choice",58,5,"",1,93,"Skills and Training","Skills and Training"
365,"2024-08-19T09:56:53.000Z",3931,"2024-08-19T09:56:53.000Z",3931,"Our organization encourages continuous learning and upskilling related to no/low code technologies.","Single Choice",58,5,"",1,93,"Skills and Training","Skills and Training"
366,"2024-08-19T09:56:53.000Z",3931,"2024-08-19T09:56:53.000Z",3931,"No/low code platforms are integrated well with our existing IT infrastructure.","Single Choice",59,5,"",1,94,"Integration and Interoperability","Integration and Interoperability"
367,"2024-08-19T09:56:53.000Z",3931,"2024-08-19T09:56:53.000Z",3931,"We have processes in place to ensure interoperability between no/low code platforms and other enterprise systems.","Single Choice",59,5,"",1,94,"Integration and Interoperability","Integration and Interoperability"
368,"2024-08-19T09:56:54.000Z",3931,"2024-08-19T09:56:54.000Z",3931,"Data from no/low code applications can be seamlessly accessed and utilized across the organization.","Single Choice",59,5,"",1,94,"Integration and Interoperability","Integration and Interoperability"
369,"2024-08-19T09:56:54.000Z",3931,"2024-08-19T09:56:54.000Z",3931,"No/low code platforms have accelerated our ability to innovate.","Single Choice",60,5,"",1,95,"Innovation and Agility","Innovation and Agility"
370,"2024-08-19T09:56:54.000Z",3931,"2024-08-19T09:56:54.000Z",3931,"Our development cycles are faster due to the adoption of no/low code platforms.","Single Choice",60,5,"",1,95,"Innovation and Agility","Innovation and Agility"
371,"2024-08-19T09:56:54.000Z",3931,"2024-08-19T09:56:54.000Z",3931,"We can quickly respond to business needs and changes using no/low code solutions.","Single Choice",60,5,"",1,95,"Innovation and Agility","Innovation and Agility"
372,"2024-08-19T09:56:54.000Z",3931,"2024-08-19T09:56:54.000Z",3931,"Employees are enthusiastic about using no/low code platforms.","Single Choice",61,5,"",1,96,"User Adoption and Engagement","User Adoption and Engagement"
373,"2024-08-19T09:56:54.000Z",3931,"2024-08-19T09:56:54.000Z",3931,"There is a high level of user engagement with no/low code solutions.","Single Choice",61,5,"",1,96,"User Adoption and Engagement","User Adoption and Engagement"
374,"2024-08-19T09:56:54.000Z",3931,"2024-08-19T09:56:54.000Z",3931,"We have champions or advocates promoting the use of no/low code technologies within the organization.","Single Choice",61,5,"",1,96,"User Adoption and Engagement","User Adoption and Engagement"
375,"2024-08-19T10:06:52.000Z",3931,"2024-08-19T10:08:25.000Z",3931,"Does your organization have reference data?","Single Choice",18,6,"",1,29,"Reference & Master Data Management","Reference & Master Data Management"
376,"2024-08-19T10:08:56.000Z",3931,"2024-08-19T10:11:27.000Z",3931,"Does your organization have master data","Single Choice",18,6,"",1,29,"Reference & Master Data Management","Reference & Master Data Management"
377,"2024-08-19T10:12:57.000Z",3931,"2024-08-19T10:14:29.000Z",3931,"How effectively does your organization protect and secure its data against unauthorized access, breaches, and other security threats?","Single Choice",18,6,"",1,29,"Reference & Master Data Management","Reference & Master Data Management"
378,"2024-08-19T10:15:05.000Z",3931,"2024-08-19T10:16:32.000Z",3931,"How confident are you that your answers for this section are correct and offer a fair and balanced view?","Single Choice",18,6,"",1,29,"Reference & Master Data Management","Reference & Master Data Management"
379,"2024-08-19T10:28:48.000Z",3931,"2024-08-19T10:31:12.000Z",3931,"Do staff know how to use data to make decisions or evaluate the performance of themselves and their business units?","Single Choice",20,6,"",1,31,"Data Warehousing & Business Intelligence","Data Warehousing & Business Intelligence"
380,"2024-08-19T10:31:38.000Z",3931,"2024-08-19T10:38:04.000Z",3931,"Do staff know how to access and share data?","Single Choice",20,6,"",1,31,"Data Warehousing & Business Intelligence","Data Warehousing & Business Intelligence"
381,"2024-08-19T10:38:46.000Z",3931,"2024-08-19T10:40:28.000Z",3931,"Does your organization use data to measure benefits of its initiatives?","Single Choice",20,6,"",1,31,"Data Warehousing & Business Intelligence","Data Warehousing & Business Intelligence"
382,"2024-08-19T10:41:13.000Z",3931,"2024-08-19T10:43:36.000Z",3931,"Does your organization have standardized tooling to allow consistent access to business intelligence?","Single Choice",20,6,"",1,31,"Data Warehousing & Business Intelligence","Data Warehousing & Business Intelligence"
383,"2024-08-19T10:44:05.000Z",3931,"2024-08-19T10:45:29.000Z",3931,"Are members of the organization aware of how to treat data as an organizational asset?","Single Choice",20,6,"",1,31,"Data Warehousing & Business Intelligence","Data Warehousing & Business Intelligence"
384,"2024-08-19T10:46:08.000Z",3931,"2024-08-19T10:52:42.000Z",3931,"How confident are you that your answers for this section are correct and offer a fair and balanced view?","Single Choice",20,6,"",1,31,"Data Warehousing & Business Intelligence","Data Warehousing & Business Intelligence"
385,"2024-08-19T11:03:18.000Z",3931,"2024-08-19T11:05:11.000Z",3931,"In your organization, is there a data dictionary for key organizational terms?","Single Choice",22,6,"",1,33,"Metadata Management","Metadata Management"
386,"2024-08-19T11:05:39.000Z",3931,"2024-08-19T11:17:04.000Z",3931,"In your organization, do business domains agree on the terms and definitions included in the data dictionary?","Single Choice",22,6,"",1,33,"Metadata Management","Metadata Management"
387,"2024-08-19T11:17:38.000Z",3931,"2024-08-19T11:19:05.000Z",3931,"In your organization, do business domains agree on a common definition of the term Metadata?","Single Choice",22,6,"",1,33,"Metadata Management","Metadata Management"
388,"2024-08-19T11:19:43.000Z",3931,"2024-08-19T11:23:04.000Z",3931,"In your organization, is a data warehouse or content management system is used to store technical metadata?","Single Choice",22,6,"",1,33,"Metadata Management","Metadata Management"
389,"2024-08-19T11:23:31.000Z",3931,"2024-08-19T11:24:56.000Z",3931,"Have your organizational needs to support technical, business, and operational metadata been identified and defined?","Single Choice",22,6,"",1,33,"Metadata Management","Metadata Management"
390,"2024-08-19T11:25:34.000Z",3931,"2024-08-19T11:27:00.000Z",3931,"Does your organization have a formal data classification policy in place?","Single Choice",22,6,"",1,33,"Metadata Management","Metadata Management"
391,"2024-08-19T11:27:23.000Z",3931,"2024-08-19T11:28:53.000Z",3931,"Are all employees aware of and trained on the data classification policy?","Single Choice",22,6,"",1,33,"Metadata Management","Metadata Management"
392,"2024-08-19T11:29:28.000Z",3931,"2024-08-19T11:32:09.000Z",3931,"Is there a clear set of criteria used for classifying data in your organization?","Single Choice",22,6,"",1,33,"Metadata Management","Metadata Management"
393,"2024-08-19T11:33:07.000Z",3931,"2024-08-19T11:35:15.000Z",3931,"How frequently is data categorically reviewed and updated to reflect current classification needs?","Single Choice",22,6,"",1,33,"Metadata Management","Metadata Management"
394,"2024-08-19T11:45:48.000Z",3931,"2024-08-19T11:47:17.000Z",3931,"Are security measures and access controls implemented based on the classification level of the data?","Single Choice",22,6,"",1,33,"Metadata Management","Metadata Management"
395,"2024-08-19T11:48:12.000Z",3931,"2024-08-19T11:49:48.000Z",3931,"How often are classification policies and procedures audited for compliance and effectiveness?","Single Choice",22,6,"",1,33,"Metadata Management","Metadata Management"
396,"2024-08-19T11:50:48.000Z",3931,"2024-08-19T11:53:46.000Z",3931,"Has your organization experienced any issues due to misclassification of data (e.g. data breaches, compliance fines)?","Single Choice",22,6,"",1,33,"Metadata Management","Metadata Management"
397,"2024-08-19T11:55:39.000Z",3931,"2024-08-19T11:59:28.000Z",3931,"How often do employees receive training on data classification responsibilities?","Single Choice",22,6,"",1,33,"Metadata Management","Metadata Management"
398,"2024-08-19T12:00:26.000Z",3931,"2024-08-19T12:01:47.000Z",3931,"How confident are you that your answers for this section are correct and offer a fair and balanced view?","Single Choice",22,6,"",1,33,"Metadata Management","Metadata Management"
399,"2024-08-21T07:54:49.000Z",3888,"2024-08-21T07:54:49.000Z",3888,"Test Question 2","Single Choice",49,3,"",1,72,"test level","test level 2"
400,"2024-08-21T08:01:38.000Z",3888,"2024-08-21T08:01:38.000Z",3888,"Test Question 2","Single Choice",49,3,"",1,72,"test level","test level 2"
401,"2024-08-21T11:08:03.000Z",3888,"2024-08-21T11:08:03.000Z",3888,"Test Question 2","Single Choice",49,3,"",1,72,"test level","test level 2"
402,"2024-08-21T11:14:13.000Z",3888,"2024-08-21T11:14:13.000Z",3888,"Test Question 2","Single Choice",49,3,"",1,72,"test level","test level 2"
403,"2024-08-21T12:29:50.000Z",3888,"2024-08-21T12:29:50.000Z",3888,"Test Question 2","Single Choice",49,3,"",1,72,"test level","test level 2"
404,"2024-08-21T12:36:58.000Z",3888,"2024-08-21T12:36:58.000Z",3888,"Test Question 2","Single Choice",49,3,"",1,72,"test level","test level 2"
